{
  "app_name": "monitoring_app",
  "description": "Smart home temperature monitoring system with cloud analytics",
  "version": "0.1.0",
  "problem_type": "monitoring",
  "requirements": [
    "Collect temperature data from IoT sensors",
    "Process and filter data at edge gateway",
    "Store aggregated data in cloud database",
    "Real-time monitoring and alerts"
  ],
  "constraints": {
    "latency": "Real-time for alerts, periodic for storage",
    "data_volume": "High frequency sensor readings"
  },
  "components_outline": [
    {
      "id": "sensor_collector",
      "type": "data_source",
      "capabilities": [
        "sense",
        "collect"
      ]
    },
    {
      "id": "data_processor",
      "type": "processor",
      "capabilities": [
        "filter",
        "aggregate",
        "analyze"
      ]
    },
    {
      "id": "storage_service",
      "type": "storage",
      "capabilities": [
        "store",
        "query"
      ]
    }
  ],
  "links_outline": [
    {
      "id": "link_sensor_to_processor",
      "from": "sensor_collector",
      "to": "data_processor",
      "data_type": "sensor_reading",
      "frequency": "real-time"
    },
    {
      "id": "link_processor_to_storage",
      "from": "data_processor",
      "to": "storage_service",
      "data_type": "processed_data",
      "frequency": "periodic"
    }
  ],
  "notes": "Deterministic planner output (pre-IR)",
  "generated_at": "2026-01-05T09:35:30.930474"
}