{
  "app_name": "automation_app",
  "description": "智能家居安防自动化系统：门磁和人体传感器联动夜间照明，异常情况实时通知，支持离家模式和安防策略",
  "version": "0.1.0",
  "problem_type": "automation",
  "requirements": [
    "门磁传感器检测门窗开关状态",
    "人体传感器检测室内人员活动",
    "夜间模式：检测到人体活动时自动开灯",
    "离家模式：检测到门磁触发时发送告警通知",
    "安防模式：门磁+人体双重检测触发警报",
    "异常情况（如传感器离线）发送故障通知",
    "支持远程查询系统状态和历史记录",
    "容错处理：传感器故障时使用备用策略"
  ],
  "constraints": {
    "latency": "传感器事件实时响应（<500ms），通知推送（<2s）",
    "data_volume": "传感器事件流：10-50 events/min，状态查询：低频",
    "reliability": "高可用性，支持传感器故障降级",
    "security": "离家模式需要认证，敏感数据加密传输"
  },
  "components_outline": [
    {
      "id": "door_monitor",
      "type": "data_source",
      "capabilities": [
        "detect_state_change",
        "binary_sensing"
      ]
    },
    {
      "id": "motion_detector",
      "type": "sensor",
      "capabilities": [
        "detect_motion",
        "presence_sensing"
      ]
    },
    {
      "id": "lighting_controller",
      "type": "actuator",
      "capabilities": [
        "control_light",
        "dimming"
      ]
    },
    {
      "id": "automation_engine",
      "type": "processor",
      "capabilities": [
        "rule_eval",
        "event_routing",
        "mode_management"
      ]
    },
    {
      "id": "notification_service",
      "type": "notification",
      "capabilities": [
        "push_alert",
        "message_delivery"
      ]
    },
    {
      "id": "data_recorder",
      "type": "storage",
      "capabilities": [
        "store",
        "query",
        "time_series"
      ]
    }
  ],
  "links_outline": [
    {
      "id": "link_door_to_engine",
      "from": "door_monitor",
      "to": "automation_engine",
      "data_type": "state_event",
      "frequency": "event-driven"
    },
    {
      "id": "link_motion_to_engine",
      "from": "motion_detector",
      "to": "automation_engine",
      "data_type": "motion_event",
      "frequency": "event-driven"
    },
    {
      "id": "link_engine_to_light",
      "from": "automation_engine",
      "to": "lighting_controller",
      "data_type": "control_command",
      "frequency": "on-demand"
    },
    {
      "id": "link_engine_to_notify",
      "from": "automation_engine",
      "to": "notification_service",
      "data_type": "alert",
      "frequency": "event-driven"
    },
    {
      "id": "link_engine_to_storage",
      "from": "automation_engine",
      "to": "data_recorder",
      "data_type": "event_log",
      "frequency": "periodic"
    }
  ],
  "notes": "Deterministic planner output (pre-IR)",
  "generated_at": "2025-12-24T20:21:08.137504"
}